{
  "$schema": "https://json-schema.org/draft/2020-12/schema",
  "$id": "urn:last-safe-ms:results:2",
  "type": "object",
  "required": [
    "schema_version",
    "models",
    "config",
    "runs",
    "baseline"
  ],
  "properties": {
    "schema_version": {
      "const": 2
    },
    "models": {
      "type": "array",
      "items": {
        "type": "object",
        "required": [
          "role",
          "provider",
          "requested_model",
          "served_model",
          "sdk_package",
          "sdk_version"
        ],
        "properties": {
          "role": {
            "type": "string"
          },
          "provider": {
            "type": "string"
          },
          "requested_model": {
            "type": "string"
          },
          "served_model": {
            "type": [
              "string",
              "null"
            ]
          },
          "sdk_package": {
            "type": "string"
          },
          "sdk_version": {
            "type": "string"
          }
        }
      }
    },
    "config": {
      "type": "object",
      "required": [
        "env_id",
        "frameskip",
        "repeat_action_probability",
        "full_action_space",
        "max_num_frames_per_episode",
        "obs_type",
        "wrappers",
        "decision_interval_steps",
        "state_encoding",
        "ale_py_version",
        "gymnasium_version"
      ]
    },
    "runs": {
      "type": "array",
      "items": {
        "type": "object",
        "required": [
          "score",
          "steps",
          "frames",
          "lives_lost",
          "model_calls",
          "input_tokens",
          "output_tokens",
          "latency_ms_p50",
          "latency_ms_p95",
          "latency_ms_total",
          "retries",
          "fallback_actions",
          "cost_usd",
          "timeout_count",
          "invalid_output_count",
          "mean_confidence",
          "deadline_adjusted_accuracy",
          "ordinary_accuracy",
          "seed",
          "terminated",
          "truncated",
          "errors_by_status"
        ],
        "properties": {
          "score": {
            "type": "number",
            "minimum": 0
          },
          "steps": {
            "type": "number",
            "minimum": 0
          },
          "frames": {
            "type": "number",
            "minimum": 0
          },
          "lives_lost": {
            "type": "number",
            "minimum": 0
          },
          "model_calls": {
            "type": "number",
            "minimum": 0
          },
          "input_tokens": {
            "type": "number",
            "minimum": 0
          },
          "output_tokens": {
            "type": "number",
            "minimum": 0
          },
          "latency_ms_p50": {
            "type": "number",
            "minimum": 0
          },
          "latency_ms_p95": {
            "type": "number",
            "minimum": 0
          },
          "latency_ms_total": {
            "type": "number",
            "minimum": 0
          },
          "retries": {
            "type": "number",
            "minimum": 0
          },
          "fallback_actions": {
            "type": "number",
            "minimum": 0
          },
          "cost_usd": {
            "type": "number",
            "minimum": 0
          },
          "timeout_count": {
            "type": "number",
            "minimum": 0
          },
          "invalid_output_count": {
            "type": "number",
            "minimum": 0
          },
          "mean_confidence": {
            "type": "number",
            "minimum": 0,
            "maximum": 1
          },
          "deadline_adjusted_accuracy": {
            "type": "number",
            "minimum": 0,
            "maximum": 1
          },
          "ordinary_accuracy": {
            "type": "number",
            "minimum": 0,
            "maximum": 1
          },
          "seed": {
            "type": "integer"
          },
          "terminated": {
            "type": "boolean"
          },
          "truncated": {
            "type": "boolean"
          },
          "errors_by_status": {
            "type": "object",
            "additionalProperties": {
              "type": "integer",
              "minimum": 0
            }
          }
        }
      }
    },
    "baseline": {
      "type": "object",
      "required": [
        "model",
        "runs"
      ],
      "properties": {
        "model": {
          "type": "string"
        },
        "runs": {
          "type": "array",
          "items": {
            "type": "object",
            "required": [
              "score",
              "steps",
              "frames",
              "lives_lost",
              "model_calls",
              "input_tokens",
              "output_tokens",
              "latency_ms_p50",
              "latency_ms_p95",
              "latency_ms_total",
              "retries",
              "fallback_actions",
              "cost_usd",
              "timeout_count",
              "invalid_output_count",
              "mean_confidence",
              "deadline_adjusted_accuracy",
              "ordinary_accuracy",
              "seed",
              "terminated",
              "truncated",
              "errors_by_status"
            ],
            "properties": {
              "score": {
                "type": "number",
                "minimum": 0
              },
              "steps": {
                "type": "number",
                "minimum": 0
              },
              "frames": {
                "type": "number",
                "minimum": 0
              },
              "lives_lost": {
                "type": "number",
                "minimum": 0
              },
              "model_calls": {
                "type": "number",
                "minimum": 0
              },
              "input_tokens": {
                "type": "number",
                "minimum": 0
              },
              "output_tokens": {
                "type": "number",
                "minimum": 0
              },
              "latency_ms_p50": {
                "type": "number",
                "minimum": 0
              },
              "latency_ms_p95": {
                "type": "number",
                "minimum": 0
              },
              "latency_ms_total": {
                "type": "number",
                "minimum": 0
              },
              "retries": {
                "type": "number",
                "minimum": 0
              },
              "fallback_actions": {
                "type": "number",
                "minimum": 0
              },
              "cost_usd": {
                "type": "number",
                "minimum": 0
              },
              "timeout_count": {
                "type": "number",
                "minimum": 0
              },
              "invalid_output_count": {
                "type": "number",
                "minimum": 0
              },
              "mean_confidence": {
                "type": "number",
                "minimum": 0,
                "maximum": 1
              },
              "deadline_adjusted_accuracy": {
                "type": "number",
                "minimum": 0,
                "maximum": 1
              },
              "ordinary_accuracy": {
                "type": "number",
                "minimum": 0,
                "maximum": 1
              },
              "seed": {
                "type": "integer"
              },
              "terminated": {
                "type": "boolean"
              },
              "truncated": {
                "type": "boolean"
              },
              "errors_by_status": {
                "type": "object",
                "additionalProperties": {
                  "type": "integer",
                  "minimum": 0
                }
              }
            }
          }
        }
      }
    }
  }
}