{
  "schema_version": 2,
  "models": [
    {
      "role": "decider",
      "provider": "mock",
      "requested_model": "mock-random-v1",
      "served_model": "mock-random-v1",
      "sdk_package": "bench",
      "sdk_version": "0.1.0"
    },
    {
      "role": "baseline",
      "provider": "mock",
      "requested_model": "mock-random-v1",
      "served_model": "mock-random-v1",
      "sdk_package": "bench",
      "sdk_version": "0.1.0"
    }
  ],
  "config": {
    "env_id": "ALE/SpaceInvaders-v5",
    "frameskip": 4,
    "repeat_action_probability": 0.25,
    "full_action_space": false,
    "max_num_frames_per_episode": 108000,
    "obs_type": "ram",
    "wrappers": [],
    "decision_interval_steps": 1,
    "state_encoding": "RAM bytes decoded to ship x, alien grid, bullets, shields, lives as JSON",
    "ale_py_version": "0.12.1",
    "gymnasium_version": "1.3.0",
    "oracle_horizon_frames": 48,
    "oracle_max_delay_frames": 12,
    "oracle_delay_step_frames": 1,
    "oracle_policy": "NOOP delay then hold action to common horizon",
    "latency_policy": "offline counterfactual; online immediate action",
    "fps": 60,
    "beyond_sweep_policy": "conservatively fail deadline metric; report count"
  },
  "runs": [
    {
      "run_id": "mock-decider-1-0-9041e06b",
      "backend": "mock",
      "role": "decider",
      "seed": 1,
      "episode": 0,
      "score": 60.0,
      "steps": 484,
      "frames": 1933,
      "lives_lost": 3,
      "terminated": true,
      "truncated": false,
      "truncation_reason": null,
      "model_calls": 484,
      "input_tokens": 0,
      "output_tokens": 0,
      "latency_ms_p50": 0.0013329554349184036,
      "latency_ms_p95": 0.0028267386369407164,
      "latency_ms_total": 0.7771293167024851,
      "errors_by_status": {},
      "retries": 0,
      "fallback_actions": 0,
      "mean_confidence": 0.16666666666666666,
      "ordinary_accuracy": 0.8698347107438017,
      "deadline_adjusted_accuracy": 0.7954545454545454,
      "timeout_count": 0,
      "invalid_output_count": 0,
      "beyond_sweep_count": 0,
      "cost_usd": 0.0,
      "pricing_basis": {
        "date": "2026-09-29",
        "unit": "USD per million tokens",
        "input": 0,
        "output": 0,
        "source": "local mock, no billable tokens"
      },
      "brier_score": 0.6076675849403123,
      "calibration_bins": [
        {
          "lower": 0.1,
          "count": 484,
          "confidence": 0.16666666666666666,
          "accuracy": 0.8698347107438017
        }
      ],
      "ece": 0.7031680440771351,
      "mixed_safety_snapshots": 0,
      "mixed_correctness_snapshots": 87,
      "safe_action_labels": 2688,
      "unsafe_action_labels": 216,
      "trace": "artifacts/mock-decider-1-0-9041e06b.jsonl",
      "served_models": [
        "mock-random-v1"
      ]
    },
    {
      "run_id": "mock-decider-2-0-2e6333a1",
      "backend": "mock",
      "role": "decider",
      "seed": 2,
      "episode": 0,
      "score": 105.0,
      "steps": 495,
      "frames": 1977,
      "lives_lost": 3,
      "terminated": true,
      "truncated": false,
      "truncation_reason": null,
      "model_calls": 495,
      "input_tokens": 0,
      "output_tokens": 0,
      "latency_ms_p50": 0.0012919772416353226,
      "latency_ms_p95": 0.0025840243324637413,
      "latency_ms_total": 0.7707597687840462,
      "errors_by_status": {},
      "retries": 0,
      "fallback_actions": 0,
      "mean_confidence": 0.1666666666666666,
      "ordinary_accuracy": 0.9050505050505051,
      "deadline_adjusted_accuracy": 0.8323232323232324,
      "timeout_count": 0,
      "invalid_output_count": 0,
      "beyond_sweep_count": 0,
      "cost_usd": 0.0,
      "pricing_basis": {
        "date": "2026-09-29",
        "unit": "USD per million tokens",
        "input": 0,
        "output": 0,
        "source": "local mock, no billable tokens"
      },
      "brier_score": 0.6311447811447813,
      "calibration_bins": [
        {
          "lower": 0.1,
          "count": 495,
          "confidence": 0.1666666666666666,
          "accuracy": 0.9050505050505051
        }
      ],
      "ece": 0.7383838383838385,
      "mixed_safety_snapshots": 0,
      "mixed_correctness_snapshots": 61,
      "safe_action_labels": 2754,
      "unsafe_action_labels": 216,
      "trace": "artifacts/mock-decider-2-0-2e6333a1.jsonl",
      "served_models": [
        "mock-random-v1"
      ]
    }
  ],
  "baseline": {
    "model": "mock-random-v1",
    "runs": [
      {
        "run_id": "mock-baseline-1-0-9cddbf2b",
        "backend": "mock",
        "role": "baseline",
        "seed": 1,
        "episode": 0,
        "score": 60.0,
        "steps": 484,
        "frames": 1933,
        "lives_lost": 3,
        "terminated": true,
        "truncated": false,
        "truncation_reason": null,
        "model_calls": 484,
        "input_tokens": 0,
        "output_tokens": 0,
        "latency_ms_p50": 0.0013748649507761002,
        "latency_ms_p95": 0.0030831084586679935,
        "latency_ms_total": 0.8116569370031357,
        "errors_by_status": {},
        "retries": 0,
        "fallback_actions": 0,
        "mean_confidence": 0.16666666666666666,
        "ordinary_accuracy": 0.8698347107438017,
        "deadline_adjusted_accuracy": 0.7954545454545454,
        "timeout_count": 0,
        "invalid_output_count": 0,
        "beyond_sweep_count": 0,
        "cost_usd": 0.0,
        "pricing_basis": {
          "date": "2026-09-29",
          "unit": "USD per million tokens",
          "input": 0,
          "output": 0,
          "source": "local mock, no billable tokens"
        },
        "brier_score": 0.6076675849403123,
        "calibration_bins": [
          {
            "lower": 0.1,
            "count": 484,
            "confidence": 0.16666666666666666,
            "accuracy": 0.8698347107438017
          }
        ],
        "ece": 0.7031680440771351,
        "mixed_safety_snapshots": 0,
        "mixed_correctness_snapshots": 87,
        "safe_action_labels": 2688,
        "unsafe_action_labels": 216,
        "trace": "artifacts/mock-baseline-1-0-9cddbf2b.jsonl",
        "served_models": [
          "mock-random-v1"
        ]
      },
      {
        "run_id": "mock-baseline-2-0-5dea97cb",
        "backend": "mock",
        "role": "baseline",
        "seed": 2,
        "episode": 0,
        "score": 105.0,
        "steps": 495,
        "frames": 1977,
        "lives_lost": 3,
        "terminated": true,
        "truncated": false,
        "truncation_reason": null,
        "model_calls": 495,
        "input_tokens": 0,
        "output_tokens": 0,
        "latency_ms_p50": 0.0014170072972774506,
        "latency_ms_p95": 0.0036329496651887816,
        "latency_ms_total": 0.9483646135777235,
        "errors_by_status": {},
        "retries": 0,
        "fallback_actions": 0,
        "mean_confidence": 0.1666666666666666,
        "ordinary_accuracy": 0.9050505050505051,
        "deadline_adjusted_accuracy": 0.8323232323232324,
        "timeout_count": 0,
        "invalid_output_count": 0,
        "beyond_sweep_count": 0,
        "cost_usd": 0.0,
        "pricing_basis": {
          "date": "2026-09-29",
          "unit": "USD per million tokens",
          "input": 0,
          "output": 0,
          "source": "local mock, no billable tokens"
        },
        "brier_score": 0.6311447811447813,
        "calibration_bins": [
          {
            "lower": 0.1,
            "count": 495,
            "confidence": 0.1666666666666666,
            "accuracy": 0.9050505050505051
          }
        ],
        "ece": 0.7383838383838385,
        "mixed_safety_snapshots": 0,
        "mixed_correctness_snapshots": 61,
        "safe_action_labels": 2754,
        "unsafe_action_labels": 216,
        "trace": "artifacts/mock-baseline-2-0-5dea97cb.jsonl",
        "served_models": [
          "mock-random-v1"
        ]
      }
    ]
  }
}
